titulo,contenido,autor,fecha,url,emocionalidad_full,subjetividad_full,objetividad_full,seccion
"España: un ""grave acto de sabotaje"" dejó sin trenes a más de 10 mil pasajeros","EN VIVO En las últimas horas,las redes ferroviarias de España se vieron nuevamente afectadas,esta vez no por uncorte masivo de luzsino por unrobo de cables, un hecho que está siendo investigado y que el Gobierno calificó como un""acto de grave sabotaje"". En total, sufrieron complicaciones al menos30 trenesque conectan con el sur del país ymás de 10.000 pasajeros. ""La Guardia Civil abrió una investigación sobre el robo del cableado de cobre que ha afectado a la red de alta velocidad"", indicó el Ministerio del Interior en la red social X, donde explicó quelas autoridades buscan ""aclarar lo sucedido e identificar a los responsables"". El robo se produjo este domingo encinco puntos de la transitada línea de alta velocidad que conecta Madrid con Sevilla,según precisó el Ministerio de Transportes. Estos puntos, ubicados en la provincia de Toledo, estaban a ""escasos kilómetros de distancia"", aclaró la cartera. Este hecho causó importantes perturbaciones del tráfico ferroviario en la noche del domingo y la mañana del lunes, tanto en lalínea Madrid-Sevilla, como en las deMadrid-Málaga (sur), Madrid-Granada (sur) y Madrid-Valencia (este). El lunes por la mañana, el tráfico volvía progresivamente a la normalidad.Los retrasos, que alcanzaron hasta diez horas en algunos trenes,quedarán totalmente resueltos durante la tarde, aseguró el gestor de la red ferroviaria española (Adif). Por redes sociales, el ministro de Transportes, Oscar Puente, calificó el robo como un""acto de grave sabotaje"", y agregó:""Es una acción bastante coordinada. Quien lo hacía sabía a lo que iba"". Según Puente, lo sustraído (150 metros de cable) es de escaso valor (unos mil euros) en comparación con el gran perjuicio causado, al tiempo que advirtió que se trató de una acción intencionada en unazona vallada, pero sin cámaras de seguridad. ""Miles de españoles atrapados en trenes de madrugada. Sin agua. Sin nada.Son imágenes impropias de la cuarta economía del euro"", criticó en X Alberto Núñez Feijóo, líder del Partido Popular (PP), principal formación de la oposición de derecha. Las demoras en el servicio ferroviario tuvieron lugar apenasuna semana después del masivo apagón eléctrico que afectó a toda la península ibéricay que, entre otras muchas perturbaciones, detuvo todos los trenes, generando el caos durante horas en múltiples estaciones de España. Conocé todas las opciones del contenido que podés recibir en tu correo. Noticias, cultura, ciencia, economía, diversidad, lifestyle y mucho más, con la calidad de información del Grupo Octubre, el motor cultural de América Latina. Este es un contenido original realizado por nuestra redacción. Sabemos que valorás la información rigurosa, con una mirada que va más allá de los datos y del bombardeo cotidiano. Hace 37 añosPágina|12asumió un compromiso con el periodismo, lo sostiene y cuenta con vos para renovarlo cada día.",Desconocido,2025-05-06T00:01:00-03:00,https://www.pagina12.com.ar/823224-espana-un-grave-acto-de-sabotaje-dejo-sin-trenes-a-mas-de-10,1.1404850482940674,0.45462901439645625,0.5453709856035438,sociedad
"150 despidos, 65 años perdidos","EN VIVO Más de cien trabajadores de la Fábrica de Bolsas Industriales (FABI) fueron despedidos está semana sin aviso previo, porproblemas de ""rentabilidad"", explicó la firma en un comunicado. La compañia tenía 65 años de trayectoria. La planta ubicada en la localidad de Hinojo, municipio de Olavarría, provincia de Buenos Aires, cerró sus puertas este martes ydesafectó a todo el personal.  “Nos dijeron que se cerraba hoy mismo y ahora les están liquidando a todos. Ofrecen pagar lo que le corresponde a cada uno más un 15 por ciento si aceptan el contrato, y si no, lo que corresponde según la ley”, afirmó al medio local Verte TV uno de los empleados. Representantes de la empresa dueña de la fábrica, de capitales extranjeros,negociaban con cada operario el pago de la indemnizacióny desde el Ministerio de Trabajo bonaerense se acercaron al lugar para conocer la situación y buscar una solución al conflicto. “Vinieron el gerente de Perú y gente de recursos humanos de Chile a comunicar la situación a todos los que estaban en el turno”, añadió. Se trata de120 trabajadores afectados entre operarios y contratados. “Nadie lo vio venir. Estamos desahuciados”, lamentó otro de los trabajadores. “La determinación de cerrar la planta de Hinojo se debe a que, a pesar de las medidas implementadas en los últimos años por reencauzar su modelo productivo y luego de analizar múltiples escenarios,la operación no es sustentable en el tiempo”, argumentó la compañía en un comunicado, donde agradeció a los trabajadores y a la comunidad local por acompañarlos estos años. En ese sentido, los empresarios aseguraron que por esa razón contemplan ""propuestas de salida superiores a las que establece la ley y, además, un servicio de recolocación laboral para los trabajadores, que incluye capacitación y talleres para ayudar a su pronta empleabilidad”. La división Sack Kraft de CMPC Biopackaging, según detallan en su página web, es unproveedor continental de sacos multipliego de papel, filial de CMPC, una de las mayores compañías del mundo en la industria forestal, celulosa y del papel. Además de la que funcionaba hasta está semana en Argentinatiene siete plantas  industriales ""estratégicamente localizadas"" en Brasil, Chile, México y Perú,""complementadas con una red comercial que incluye una oficina comercial en USA y una plataforma logística que le permite atender hoy en día a más de 25 países en la región"". Sin embargo, en el país, la política económica de la Libertad Avanza provocó el encarecimiento de los costos en dólares y el ingreso de los mismos productos importados porprecios con lo que no pueden competir produciéndolos en territorio nacional. Conocé todas las opciones del contenido que podés recibir en tu correo. Noticias, cultura, ciencia, economía, diversidad, lifestyle y mucho más, con la calidad de información del Grupo Octubre, el motor cultural de América Latina. Este es un contenido original realizado por nuestra redacción. Sabemos que valorás la información rigurosa, con una mirada que va más allá de los datos y del bombardeo cotidiano. Hace 37 añosPágina|12asumió un compromiso con el periodismo, lo sostiene y cuenta con vos para renovarlo cada día.",Desconocido,2025-04-12T00:01:00-03:00,https://www.pagina12.com.ar/817515-150-despidos-65-anos-perdidos,1.1761155128479004,0.26982758620689656,0.7301724137931034,economia
"Línea Sarmiento: demoras, usuarios varados y advertencia de la Unión Ferroviaria","EN VIVO Este miércoles, como viene ocurriendo con alarmante frecuencia, laLínea Sarmientovolvió a colapsar. Desde temprano, miles de usuarios quedaron varados por fallas en el obsoleto sistema de señales, dejando el servicio limitado entreLiniers y Moreno. LaUnión Ferroviaria (UF)no tardó en denunciar lo que para los trabajadores es una consecuencia directa de las políticas oficiales:“El vaciamiento colapsa el servicio”.   El desperfecto, informado oficialmente por laDirección General de Seguridad en Medios de Transporte, comenzó pasado el mediodía de este miércoles y se extendió hasta pasadas las 18. Según comunicó elSubgerente de Seguridad de la línea,Roberto Fernández, la falla técnica afectó el tendido entreCaballito y Once, el tramo más crítico del recorrido. Por ese motivo se ordenócerrar el hall central de Oncey limitar el servicio entreLiniers y Moreno. Finalmente, el funcionamiento fue restablecido horas más tarde, aunque sin una solución de fondo para un sistema queacumula décadas de desinversión. La UF denunció que la falla no es un hecho aislado, sino consecuencia dedécadas de desinversióny una política de vaciamiento que se profundizó bajo la gestión deJavier Milei. “Gobierno tras gobierno se han negado a invertir o lo hicieron mal, mezclando tecnologías incompatibles. Pero este gobierno directamente desmantela, recorta personal técnico y vacía organismos de control como la CNRT”, advierten desde laComisión de Reclamos del Sarmiento. El gremio sostiene que el Ejecutivo buscaforzar el deterioro del sistema ferroviario estatalpara justificar su privatización. La referencia es inevitable: bajo gestión privada, conTBA y los Cirigliano, el país sufrió latragedia de Once en 2012, donde murieron 52 personas y más de 700 resultaron heridas. Desde la UF reiteraron su histórica demanda dereestatización total del sistema ferroviario, integrando carga y pasajeros bajo unaempresa estatal gestionada por sus trabajadores, como única vía para garantizar seguridad y eficiencia. En paralelo a la crisis operativa, el gobierno oficializó cambios enTrenes Argentinos.Gerardo Boschin, ex gerente de ARSAT, quedó al frente deTrenes Argentinos Operaciones, mientrasLeonardo Fabián Comperatoreasumió enTrenes Argentinos Infraestructura. Los salientesMatías GalparsoroyMarcelo Krajzelmancontinuarán--según aclararon en un comunicado-- en roles técnicos. El recambio se da en plenaEmergencia Ferroviaria, declarada en marzo, que lejos de revertir el deterioro, sirvió para recortar fondos sin resolver el desastre estructural del sistema. Mientras tanto, los pasajeros del Sarmiento, casi300 mil usuarios diarios, siguen a merced de un servicio inestable y riesgoso. Cada día, un viaje convertido en lotería. Y cada demora, un recordatorio brutal de quesin inversión y sin control, el tren estatal en crisis no es casualidad: es una decisión política.   Conocé todas las opciones del contenido que podés recibir en tu correo. Noticias, cultura, ciencia, economía, diversidad, lifestyle y mucho más, con la calidad de información del Grupo Octubre, el motor cultural de América Latina. Este es un contenido original realizado por nuestra redacción. Sabemos que valorás la información rigurosa, con una mirada que va más allá de los datos y del bombardeo cotidiano. Hace 37 añosPágina|12asumió un compromiso con el periodismo, lo sostiene y cuenta con vos para renovarlo cada día.",Natalia López Gómez,2025-05-28T20:20:28-03:00,https://www.pagina12.com.ar/829496-linea-sarmiento-demoras-usuarios-varados-y-advertencia-de-la,1.2446293830871582,0.41889097744360904,0.581109022556391,sociedad
Tiroteo masivo en una escuela para adultos en Suecia,"EN VIVO Una decena de personas, entre ellas el presunto atacante, murieron baleadaseste martes en unaescuela para adultos en Suecia.  ""Este esel peor tiroteo masivo de la historia"" de Suecia, afirmó el primer ministro Ulf Kristersson en una rueda de prensa tras el ataque ocurrido después del mediodía en Örebro, una localidad situada a unos 200 kilómetros al oeste de Estocolmo. ""Hoy hemos visto una violencia mortal brutal contra personas completamente inocentes. Este es el peor tiroteo de masas en la historia sueca"", dijo en rueda de prensa Kristersson. Kristersson señaló que lo ocurrido es ""difícil de aceptar"" y mostró su ""pena sin fin"" porque ""lo que no debería haber ocurrido ha ocurrido"". ""Todavía nos faltan muchas respuestas. Yo tampoco puedo darlas"", señaló Kristersson, que invitó a no hacer especulaciones sobre los motivos del tirador y se solidarizó con las víctimas y los familiares, asegurando que ""compartimos vuestro dolor"". En una conferencia de prensa anterior, el jefe de la policía de Örebro, Roberto Eid Forest, había reportado que ""una decena de personas murieron"" en el tiroteo ocurrido en el Campus Risbergska, una escuela para adultos, sin precisar cuántos heridos dejó el ataque.""El autor no es conocido por la policía y no tiene vínculos con ninguna banda. Creemos que no habrá más ataques"", añadió. Según la cadena de televisión TV4, el presunto autor del asalto tenía 35 años y la policía registró su domicilio en Örebro. El hombre disponía de una licencia para portar armas y no tenía antecedentes penales, añadió el canal. Las autoridades no divulgaron ningún elemento sobre el perfil del agresor o sus motivaciones.Tampoco se ofreció información sobre la identidad o la edad de los fallecidos, ni si eran alumnos o profesores del centro. Los ataques en centros escolares son poco frecuentes en Suecia, miembro de la UE y de la OTAN. Pero, en los últimos años, el país ha sido escenario de tiroteos y ataques vinculados con la violencia de pandillas, que dejan a una decena de muertos cada año. En marzo de 2022, un estudiante de 18 años mató a puñaladas a dos profesores en una escuela secundaria en la ciudad de Malmo, en el sur. Las imágenes del lugar mostraron gran presencia policial con ambulancias y vehículos de emergencia. Los estudiantes de las escuelas cercanas y del centro en cuestión fueron encerrados ""por razones de seguridad"", informó la policía. La escuela Campus Risbergska es un centro de educación para adultos y, según declaró a la televisión pública SVT Lena Warenmark, una de las docentes, a la hora del tiroteo había menos alumnos de los habituales en el recinto porque muchos se habían ido a casa tras finalizar sus exámenes. Una mujer cuyo hijo fue retenido en una escuela de la zona durante varias horas durante la operación policial relató a AFP que se siente ""conmocionada"" y ""enojada"".  ""Mi hijo está en su escuela detrás de nosotros. Ellos también están encerrados. Tuvieron que esconderse, así que estoy esperando que los evacuen"", contó Cia Sandell, de 42 años.""Esto es una locura, una locura total, me siento conmocionada y enojada. Esto no debería ocurrir"", afirmó la mujer. El tiroteo está siendo investigado como ""intento de asesinato, incendio premeditado y delito agravado de armas"". El rey Carlos XVI Gustavo dijo que recibió la noticia con ""tristeza y consternación"" y envió un mensaje de condolencias a los familiares de los fallecidos, informó el palacio real en un comunicado.       Conocé todas las opciones del contenido que podés recibir en tu correo. Noticias, cultura, ciencia, economía, diversidad, lifestyle y mucho más, con la calidad de información del Grupo Octubre, el motor cultural de América Latina. Este es un contenido original realizado por nuestra redacción. Sabemos que valorás la información rigurosa, con una mirada que va más allá de los datos y del bombardeo cotidiano. Hace 37 añosPágina|12asumió un compromiso con el periodismo, lo sostiene y cuenta con vos para renovarlo cada día.",Desconocido,2025-02-05T00:01:00-03:00,https://www.pagina12.com.ar/801602-tiroteo-masivo-en-una-escuela-para-adultos-en-suecia,1.2497811317443848,0.47007246376811596,0.529927536231884,sociedad
Nueva oleada de explosiones en el Líbano: al menos tres muertos y 100 heridos,"EN VIVO Al menostres personas murieron y otras 100 resultaron heridaseste miércoles en distintos puntos del Líbano, por una nueva oleada deexplosiones en aparatos de comunicación, informaron fuentes oficiales. Se trata delsegundo ataque de este tipo en menos de 24 horas: el primero, que tuvo lugar este martes, causó11 muertos y 4000 heridos. Según la Agencia Nacional de Noticias (ANI) del Líbano, las tres muertes de este miércoles ocurrieron debido a laexplosión de ""dispositivos de transmisión"" en Sohmor, en el este del país. El Ministerio de Salud reportó por su parte ""más de 100 heridos en una nueva ola de explosiones de walkie-talkies"". Medios internacionales reportaronexplosiones en un suburbio del sur de Beirut, donde se celebraban los funerales de cuatro miembros de Hezbollah que fallecieron el martes por el estallido de beepers, según una fuente cercana al movimiento proiraní y a rescatistas. Las explosiones, contó un fotógrafo deAFPque cubría estos funerales, sembraron pánico entre los presentes. En Dahye, Beirut, un testigo que pidió el anonimato relató aEFEcómo una detonación de baja intensidad sacudió un vehículo del que salieron dos pasajeros ""completamente cubiertos en sangre"". Otro testigo afirmó que varias viviendas en ese extrarradio capitalino sufrieron incendios, mientras que las medidas de seguridad han sido intensificadas en la zona coincidiendo con el vuelo de al menos un dron. ""Estamos respondiendo con 30 equipos de ambulancias a múltiples explosiones en diferentes áreas, incluyendo el sur del Líbano y el Valle de la Bekaa"", afirmó la Cruz Roja libanesa en su cuenta de X, al agregar que su personal se encuentra en ""alta alerta"" y ""listo para intervenir"". El Ejército libanés, en tanto, pidió a la población en un escueto mensaje que no se agolpe en los puntos donde se han producido ""incidentes de seguridad"" para permitir el paso de los equipos médicos. Las áreas afectadas están controladas por el grupo chií libanés Hezbollah, como ya ocurrió con las explosiones en cadena que el martes se originaron en miles de buscapersonas en manos de miembros del movimiento, que causaron  11 muertos y 4000 heridos.  La formación chií atribuyó la autoría de la operación del martes a Israel,con quien se intensificó el conflicto a partir de la invasión de Hamas en octubre del año pasado. El secretario general de Naciones Unidas,António Guterres, dijo este miércoles que las explosiones ayer y hoy de ""dispositivos buscapersonas"" en Líbano, atribuidas a Israel, suponen la confirmación de ""riesgo grave"" de escalada en el conflicto entre la milicia libanesa chíi Hezbollah y el Estado israelí. ""La lógica de explotar todos estos artefactos es hacerlo como un ataque preventivo antes de una operación militar importante. Esto es la indicación que confirma queexiste un grave riesgo de una dramática escalada en Líbano, y hay que hacer todo lo posible para evitarla"", afirmó Guterres durante una rueda de prensa en la sede de la ONU en Nueva York. ""La relación entre lo que ocurre en Líbano y lo que pasa en Gaza es obvia desde el principio. Es decir,Hezbollah ha sido muy claro al decir que ha lanzado sus operaciones debido a lo que está ocurriendo en Gaza y que se detendrá cuando haya un alto el fuego en Gaza"", añadió el político portugués. Durante su intervención, Guterres repitió que la comunidad internacional vive hoy una situación donde ""se han multiplicado los conflictos y reina la sensación de impunidad"" y en la que""los riesgos de una nueva guerra mundial son mayores"". Conocé todas las opciones del contenido que podés recibir en tu correo. Noticias, cultura, ciencia, economía, diversidad, lifestyle y mucho más, con la calidad de información del Grupo Octubre, el motor cultural de América Latina. Este es un contenido original realizado por nuestra redacción. Sabemos que valorás la información rigurosa, con una mirada que va más allá de los datos y del bombardeo cotidiano. Hace 37 añosPágina|12asumió un compromiso con el periodismo, lo sostiene y cuenta con vos para renovarlo cada día.",Desconocido,2024-09-18T13:12:22-03:00,https://www.pagina12.com.ar/768396-nueva-oleada-de-explosiones-en-el-libano-al-menos-un-muerto-,1.2532649040222168,0.3660665478312537,0.6339334521687463,el-mundo
Derrumbe de las cotizaciones de acciones y de títulos públicos,"EN VIVO Laincertidumbre del mercado se mantiene al rojo vivo.Las acciones de las empresas argentinas que operan en Nueva York se derrumbaron este jueves y llegaron a caer hasta casi 10 por ciento. Los bonos soberanos en moneda extranjera perdieron hasta casi 4 por ciento y el riesgo país se mantiene en el rango de los 1550 puntos. Se trata de una cifra que vuelve imposible recuperar el acceso a los mercados de deuda y pone en duda la capacidad de repago de los títulos denominados en moneda extranjera. Eldólar blueque venía de marcar 5 bajas consecutiva rebotó este jueves para cerrar en 1380 pesos, con una suba de 10 pesos. Los incrementos también se registraron en los dólares financieros como el contado con liquidación y el mep, los cuales subieron cerca del 1 por ciento y terminaron por encima de los 1300 pesos. La apuesta del gobierno de bajar la brecha no se materializa mientras que se siguen perdiendo reservas internacionales. Si bien en la jornada el Banco Central intervino con compras en elmercado de cambiospor 145 millones de dólares, la entidad muestra una importante dificultad para sumar divisas a sus arcas. El mes pasado se acumularon ventas en el mercado de cambios por casi 200 millones de dólares y el nivel de reservas netas se ubican en valores negativos. Elproblema de la falta de dólaressigue en aumento para el segundo semestre debido a los pagos que deben realizarse de deuda externa. Este jueves, por caso, el Gobierno enfrentó un nuevo vencimiento con el Fondo Monetario Internacional. Se trata de un desembolso de 840 millones de dólares. Se trata de un pago de interés y sobrecargos, el anteúltimo de 2024. Desde el Banco Central estimaron que en eltercer trimestre del añose perderán cerca de 3000 millones de dólares de reservas. Una situación que parece chocar directo contra las intenciones del gobierno de levantar los controles sobre el tipo de cambio, unificar los dólares y lanzar un esquema de competencia de monedas. La situación hace ruido entre los inversores. En la agencia de bolsa Portfolio Personal Inversiones consideraron que las reservas irán en baja. ""Hacia adelante, su performance debería empeorar dado que laestacionalidad de las importacionesy exportaciones continuará jugando en contra de la acumulación de dólares”, mencionaron. Al mismo tiempo, indicaron que “se suelenvender reservasen el tercer trimestre y, al haber flexibilizado el acceso al mercado oficial para más de 60 por ciento de las importaciones, se agregó mayor presión entre septiembre y noviembre, cuando habrá un flujo del 100 por ciento de las importaciones accediendo (al mercado de cambios)”. Para las próximas semanas el mercado parece mirar de cerca eldato de inflación, que el gobierno asegura que se ubicará en los niveles más bajos del año. Sin embargo, algunas de las críticas que recibe es que la desaceleración de los precios ocurre por haber pisado el dólar oficial y algunos precios regulados, y no es sostenible con el correr de los meses. Por otro lado, el equipo económico habría indicado en reuniones con agencias de bolsa que julio terminará condéficit fiscal.Se trata de un elemento que suma presiones a las expectativas de los inversores, que desconfían del programa de emisión cero y tienen expectativas de devaluación que van en aumento a medida que las reservas internacionales se siguen comprimiendo. Conocé todas las opciones del contenido que podés recibir en tu correo. Noticias, cultura, ciencia, economía, diversidad, lifestyle y mucho más, con la calidad de información del Grupo Octubre, el motor cultural de América Latina. Este es un contenido original realizado por nuestra redacción. Sabemos que valorás la información rigurosa, con una mirada que va más allá de los datos y del bombardeo cotidiano. Hace 37 añosPágina|12asumió un compromiso con el periodismo, lo sostiene y cuenta con vos para renovarlo cada día.",Desconocido,2024-08-02T00:01:00-03:00,https://www.pagina12.com.ar/757087-derrumbe-de-las-cotizaciones-de-acciones-y-de-titulos-public,1.2546947002410889,0.27999177824759214,0.7200082217524079,economia
