titulo,contenido,autor,fecha,url,emocionalidad_full,subjetividad_full,objetividad_full,seccion
Brasil: la justicia mantiene el bloqueo a la red social X  Brasil,"EN VIVO La Corte Suprema de Brasil mantuvo este sábado el bloqueo de la red social Xpese a que la empresa del magnateElon Musknombró el viernes a un representante legalen el país, como le exigía el máximo tribunal.El magistradoAlexandre de Moraesemitió una nueva resolución en la que da cinco días a la empresa para presentar documentos adicionales que atestigüen el nombramiento de un abogado, al considerar quela petición del tribunal no había sido ""debidamente"" cumplida.Además, solicitó al Gobierno y al Banco Central que informen en 48 horas sobre la situación catastral de la plataforma, mientras el Supremo evalúa cuál es el total de las multas pendientes por pagar. Tras tres semanas de bloqueo, X, antes llamada Twitter, cedió el viernes a las exigencias del tribunal, que investiga el papel de la plataforma en la propagación de noticias falsas.   X aseguró que el restablecimiento fue la consecuencia ""involuntaria"" de un cambio de servidor y que era ""temporal"". Pero Anatel declaró lo contrario. Según esa agencia, la red social X demostró su""intención deliberada de eludir la orden del Tribunal Supremo"". Según los proveedores de internet, X accedió a los servicios de Cloudflare, que permite a las empresas cambiar constantemente de IP, en vez de contar con direcciones específicas. En la madrugada del miércoles, mientras la aplicación se actualizaba automáticamente en millones de teléfonos, Musk escribió en su cuenta de X:""La magia, cuando es lo suficientemente avanzada, es indistinguible de la tecnología"", un mensaje interpretado como una ""provocación"" por la prensa brasileña. Este jueves la red social dejó de funcionar de nuevo en Brasil, después de que la justicia le ordenara prescindir del servicio de ciberseguridad que le permitió eludir su suspensión en el país, indicó el gremio de proveedores de internet. ""Justo antes de las 16H00 (19H00 GMT) el propio X dejó de usar el servicio de Cloudflare"", por lo que la plataforma ""está bloqueada"", dijo el consejero de la Asociación Brasileña de Proveedores de Internet y Telecomunicaciones (Abrint), Basílio Rodriguez Perez. En su decisión, Moraes presentó el mensaje de Musk como una prueba de su intencionalidad. La resistencia ""maliciosa, ilícita y persistente de la plataforma X en el cumplimiento de órdenes judiciales fue confesada directamente por su mayor accionista, Elon Musk, en la publicación"" de ese tuit, dijo el juez. En la orden judicial que emitió el jueves de Moraes señaló que X debía ""inmediatamente suspender la utilización de sus nuevos accesos (...) so pena de una multa diaria de 5 millones de reales"" (U$D 913.000) El juez había dictaminado asimismo a la agencia brasileña de telecomunicaciones Anatel que adoptara todas las medidas necesarias para restablecer el bloqueo de X. Este sabado de Moraes apuntó aStarlink, la empresa de internet por satélite que también es propiedad de Musk, comoresponsable solidaria en caso de que X no pagase la multa. La red social anunció en agosto el cierre de su oficina en Brasil y dijo que no cumpliría las órdenes del Supremo para que eliminase ciertos perfiles de personas sospechosas de difundir noticias falsas, al considerarlas “ilegales”.Musk se lanzó a atacar a De Moraes, responsable por la investigación, lo acusó de ser un“dictador con toga”, y apoyó los llamados de la ultraderecha brasileña del exmandatario Jair Bolsonaro para destituirlo.   ""Todos y cada uno de los ciudadanos de cualquier parte del mundo que tienen una inversión en Brasil están sujetos a la Constitución brasileña y a las leyes del país"" explicó el mandatario. “La justicia brasileña puede haber dado una señal importante de queel mundo no está obligado a soportar el todo vale de extrema derecha de Musk sólo porque es rico”, afirmó el presidente. Musk, un autoproclamado “absolutista de la libertad de expresión”, ha afirmado repetidamente que las acciones del tribunal equivalen a censura, y su argumento ha sido compartido por la derecha política de Brasil. En entrevistas y actospolíticos el expresidenteJair Bolsonaro, líder de la ultraderecha brasileña, ha colmado deelogios al fundador de X. “Ahora acusan al hombre más rico del mundo, dueño de una plataforma cuyo objetivo es hacer libre al mundo entero, que es X, nuestro viejo Twitter.Es un hombre que preserva la libertad para todos nosotros, que tuvo el coraje de mostrar con todas las pruebas hacia dónde se dirigía nuestra democracia,” ha declarado el exmandatario.    Conocé todas las opciones del contenido que podés recibir en tu correo. Noticias, cultura, ciencia, economía, diversidad, lifestyle y mucho más, con la calidad de información del Grupo Octubre, el motor cultural de América Latina. Este es un contenido original realizado por nuestra redacción. Sabemos que valorás la información rigurosa, con una mirada que va más allá de los datos y del bombardeo cotidiano. Hace 37 añosPágina|12asumió un compromiso con el periodismo, lo sostiene y cuenta con vos para renovarlo cada día.",Desconocido,2024-09-22T00:01:00-03:00,https://www.pagina12.com.ar/769285-brasil-la-justicia-mantiene-el-bloqueo-a-la-red-social-x-bra,1.2796669006347656,,,el-mundo
Fábrica de calzado deportivo en riesgo de cierre,"EN VIVO La fábrica de calzado Bicontinentar está tomada: 170 trabajadores decidieron permanecer en las instalaciones ubicadas en el Parque Industrial del partido de Chivilcoy, en la provincia de Buenos Aires. La medida surge ante la amenaza de cierre y la consecuente pérdida de las fuentes de trabajo. Ayer en asamblea y acompañados por el gremio Unión de Trabajadores de la Industria del Calzado (UTICRA), se votó la retención de tareas y permanencia en el lugar hasta obtener alguna respuesta. ¿Van a cerrar? ¿Nos quedamos sin nuestro trabajo? ¿Piensan pagarnos las indemnizaciones?, se preguntan y comparten angustias frente al silencio aterrador de los dueños. Ya en agosto les empezaron a adelantar las licencias por vacaciones y aún no cobraron los sueldos de octubre. “Tal cual lo hicimos en anteriores oportunidades, y permitieron la reapertura de la fábrica, estamos exigiendo a través de las carteras laborales provincial y nacional, que se cumplan con los derechos de nuestras compañeras y compañeros”, informaron desde el sindicato. Fabrican y ensamblan zapatillas deportivas de alta tecnología para las marcas más reconocidas. Sin embargo, los trabajadores explican que la producción “viene cayendo”. Solo en lo que va de 2024 los pedidos de fabricación para terceros se redujeron en un 80%. Este año la empresa intentó lanzar una línea propia de botines de fútbol y otras etiquetas para repuntar la actividad, pero el proyecto no tuvo el desenlace esperado. Hasta que los dueños invirtieron en esta iniciativa, según consignan medios locales, las indemnizaciones estaban aseguradas: “se puso ese dinero apostando a algo que se cayó, no funcionó”, argumentan. Sin aviso previo, en agosto a los trabajadores les adelantaron una semana de vacaciones y ahora una más. Entonces se encendieron las alarmas: no hay recursos para garantizar la continuidad operativa de las dos líneas de producción activas en la actualidad. Y no es la primera vez que sucede. Bicontinentar Footwear Technologies anteriormente se llamó Paquetá. Era de capitales brasileños y, con ese nombre, cesó sus actividades en 2018 argumentando que se habían quedado sin clientes. Gobernaba Mauricio Macri, quien a cargo de la presidencia de la Nación aplicó políticas recesivas del consumo que afectaron la continuidad de pymes e industrias. Datos de la compañía muestran que entre 2014 y 2015 vivió su época de oro. Con dos turnos, la firma llegó a tener 16 líneas de montaje y a producir 7 millones de pares de calzado. Los 87.540 habitantes del partido de Chivilcoy celebraron en 2021 la reapertura de la fábrica: era trabajo para el pueblo. Para fines de 2022 Bicontinentar, en manos de capitales argentinos encabezados por Juan Rece,  ya generaba empleo directo e indirecto para 600 personas. “Hubo momentos en que debimos abrir una línea de producción por mes al ritmo del arribo de nuevos clientes”, recuerdan. Luego, otra vez el derrotero. En 2023 alegaron dificultades para importar insumos y afrontar pagos al exterior que ponían “trabas” a la cadena productiva. Fue cuando dejaron sin trabajo a cien personas. Datos relevados por el gremio dan cuenta de que el calzado deportivo en Argentina representa entre el 8 y 10 por ciento en la venta del rubro. “Salvo que ocurra algo extraordinario, parece inevitable que la empresa cierre”, lamentó Juan López, delegado regional sindical. Por su parte, el intendente local, Guillermo Britos, también manifestó preocupación y llamó a qué los empresarios aclaren la situación. Además les recordó el “esfuerzo que hizo la localidad para lograr la radicación y sostenimiento de la fábrica”. Este miércoles arrancaron temprano, cumplieron con sus tareas, le pusieron tiempo y amor a la confección de cada calzado y tuvieron como respuesta el último comunicado que emitió la patronal: ""Estamos trabajando en un plan para hacer frente a las obligaciones con todos los trabajadores"", reconociendo la existencia de dificultades financieras. Los trabajadores anunciaron que, hasta que no cobren, permanecerán en la planta. Este jueves, a las 11:00, habrá una  reunión del sindicato con la dirección de la empresa en la delegación del Ministerio de Trabajo bonaerense. Conocé todas las opciones del contenido que podés recibir en tu correo. Noticias, cultura, ciencia, economía, diversidad, lifestyle y mucho más, con la calidad de información del Grupo Octubre, el motor cultural de América Latina. Este es un contenido original realizado por nuestra redacción. Sabemos que valorás la información rigurosa, con una mirada que va más allá de los datos y del bombardeo cotidiano. Hace 37 añosPágina|12asumió un compromiso con el periodismo, lo sostiene y cuenta con vos para renovarlo cada día.",Desconocido,2024-11-14T00:01:00-03:00,https://www.pagina12.com.ar/782541-fabrica-de-calzado-deportivo-en-riesgo-de-cierre,1.2939846515655518,0.39869107744107746,0.6013089225589225,economia
Incendio en la sede de una obra social en Córdoba,"EN VIVO La sede central de laAdministración Provincial del Seguro de Salud (Apross), en la ciudad deCórdoba, quedó envuelta en unferoz incendiosin que se registraranvíctimas fatales ni heridos. El ministro de Seguridad provincial, Juan Pablo Quinteros, precisó desde el lugar de los hechos que ""hay mucha carga de combustible"" y laprincipal hipótesisgira en torno a ladocumentación perdidaa pocos días deuna serie de detenciones por estafas a la Apross. Los vecinos del barrio Güemes vieron alrededor de las 13 un nube densa de humo negró que surgía del edificio ubicado en la calle Marcelo T. de Alvear 728, lo que encendió las alertas por el incendio. Poco después, varias dotaciones deBomberos de la Policía de Córdoba apagaron las llamas y evacuaron edificios aledaños, mientras que las autoridades intentan determinar las causas del foco ígneo. Los videos, que se viralizaron en las redes sociales, muestran que el incendioafectó al tercer piso del inmueblede la obra social cordobesa. El jefe de Bomberos, Sergio Cravero, explicó que llegaron al lugar tras una llamada al 911 y la primera acción fue trabajar en el segundo piso para que el fuego iniciado en el tercer nivel no se propague. Por ser viernes santo, el edificio del Apross estaba vacío yno tuvo que haber rescates ni lamentar heridos ni víctimas, aunque sí se desalojó a vecinos de edificios linderos. Cravero explicó que las causas comenzarán hacer investigadas cuando se terminara con las tareas operativas de extinción del fuego. ""Se veía un humo negro terrible, hace un montón que están haciendo remodelaciones, cambiando aires. Lo que me llamó la atención es que el portón del garaje estaba cerrado con llave y siempre hay un cuidador ahí"", advirtió, al diarioLa Voz, una vecina del Pasaje Escuti y que comparte su fondo con el edificio.  Según la vecina, se alertó por la explosión de los vidrios del edificio. Otra vecina, citada porLa Voz, marcó:  ""Soy afiliada a esta obra social y sé cómo funciona. ¿Vos creés que nadie de adentro sabía de este fraude? Oh casualidad un día feriado, que no hay movimiento y a pocos días de las detenciones ocurre esto que seguramente borra pruebas"". El incendio coincide con una investigación por presuntas estafas millonarias, causa por la que este miércoles habían sido detenidas 13 personas. Se trató decinco oficiales de la Policía de Córdoba, entre ellos un subcomisario, además deun médico, un exempleado de informática y seis particulares. Los policías detenidos, dos de ellos retirados, integraban la mutual 16 de Noviembre, que es investigada por orden de la fiscalía del Distrito 1 Turno 6 de Córdoba, bajo el delito de defraudación calificada. De acuerdo a lo investigado, según el Ministerio Público Fiscal, el grupo detenido facturaba al Apross por consultas médicas, prácticas médicas, que no se realizaban. La práctica se habría repetido por años, por sumas millonarios, y fue denunciada por la propia Apross. Hay otras causas abiertas por defraudación a la obra social estatal en la que trabajan el área de fraudes de la Apross, el Ministerio Público Fiscal, Investigaciones Criminales de la Policía, detectives de la Policía Judicial y técnicos del  Ministerio de Salud. Conocé todas las opciones del contenido que podés recibir en tu correo. Noticias, cultura, ciencia, economía, diversidad, lifestyle y mucho más, con la calidad de información del Grupo Octubre, el motor cultural de América Latina. Este es un contenido original realizado por nuestra redacción. Sabemos que valorás la información rigurosa, con una mirada que va más allá de los datos y del bombardeo cotidiano. Hace 37 añosPágina|12asumió un compromiso con el periodismo, lo sostiene y cuenta con vos para renovarlo cada día.",Desconocido,2025-04-19T00:01:00-03:00,https://www.pagina12.com.ar/819205-incendio-en-la-sede-de-una-obra-social-en-cordoba,1.2978531122207642,0.28418209876543205,0.715817901234568,sociedad
Un retroceso inadmisible en la protección de los derechos laborales,"EN VIVO La Corte Suprema de Justicia de la Nación cambió su doctrina y posterga los salarios de los trabajadores de empresas en quiebra para priorizar el cobro de impuestos por parte del Estado. El fallo dictado en la causa “Acevedo, Eva María c/ Manufactura Textil San Justo s/ quiebra”, del 3 de abril, representa un grave retroceso en la protección de los derechos laborales en Argentina y un peligroso precedente que subordina la protección constitucional del trabajo a tecnicismos formales y a la discrecionalidad del Poder Ejecutivo. La Corte declaró inaplicable en el derecho interno el Convenio 173 de la Organziación Internacional del Trabajo (OIT) sobre la protección de los créditos laborales en caso de insolvencia del empleado, por falta de ratificación del Poder Ejecutivo. La Corte desestima la jerarquía normativa que dicho convenio había adquirido mediante su aprobación por el Congreso Nacional y abandona su propia jurisprudencia. El Convenio 173 de la OIT, aprobado por la ley 24.285 en 1993, establece que los créditos laborales deben gozar de un privilegio superior a los del Estado en casos de insolvencia del empleador (arts. 5 y 8). Este principio fue reconocido por el máximo tribunal en numerosos fallos, pero esta Corte no solo ignora sus propios precedentes, sino que lo hace en un contexto político, que evidencia una preocupante desconexión con la realidad social y económica de los trabajadores y trabajadoras, particularmente, en contextos de insolvencia, donde los derechos laborales están bajo ataque constante. El fallo no es técnico, es político. Es una toma de posición a favor de un modelo económico excluyente que prioriza sus propios intereses por sobre la dignidad del trabajo. En un contexto de crisis económica, donde las quiebras empresariales amenazan los derechos de los trabajadores, la CSJN desprotege a quienes dependen de sus salarios para sobrevivir para, paradójicamente, priorizar al Estado en el cobro de impuestos. La Corte, que durante tres décadas reconoció la vigencia del Convenio 173 de la OIT, ahora cede ante formalismos que nunca antes fueron obstáculo. Este fallo no puede pasar desapercibido. Es una decisión que afectará la vida de miles de trabajadores que, frente a la quiebra de sus empleadores, quedan ahora más desprotegidos. Este fallo no solo traiciona a los trabajadores, sino que compromete la supremacía constitucional y la división de poderes. Es un paso atrás en la lucha por la justicia social y un guiño a quienes persiguen un país sin derechos laborales.  El Congreso no puede ser espectador pasivo de este despojo. Tenemos la obligación de actuar, no solo para restaurar la vigencia efectiva del Convenio 173 de la OIT, sino para reafirmar, con leyes claras y firmes, que en la Argentina el trabajo sigue siendo un valor fundante y no una variable de ajuste. Frente a una Corte que les da la espalda a los trabajadores, es nuestra responsabilidad construir mayorías políticas que garanticen justicia social. *Senador Nacional por Unión por la Patria. Conocé todas las opciones del contenido que podés recibir en tu correo. Noticias, cultura, ciencia, economía, diversidad, lifestyle y mucho más, con la calidad de información del Grupo Octubre, el motor cultural de América Latina. Este es un contenido original realizado por nuestra redacción. Sabemos que valorás la información rigurosa, con una mirada que va más allá de los datos y del bombardeo cotidiano. Hace 37 añosPágina|12asumió un compromiso con el periodismo, lo sostiene y cuenta con vos para renovarlo cada día.",Desconocido,2025-04-25T00:41:58-03:00,https://www.pagina12.com.ar/820507-un-retroceso-inadmisible-en-la-proteccion-de-los-derechos-la,1.299098253250122,0.4497863247863248,0.5502136752136753,el-pais
Un accidente con un bus dejó 40 muertos,"EN VIVO Un grave accidente de ómnibus provocó al menos 40 muertos y 6 heridos de gravedad este sábado en Minas Gerais, en el sureste de Brasil. El presidente Lula dijo que es un hecho ""terrible"". Es la mayor tragedia en carreteras federales brasileñas desde el 2007, año en el que comenzó el archivo de datos policiales al respecto. La misma Policía Civil, en su balance oficial, confirmó que hubo""40 víctimas fatales"" y 6 personas internadas en grave estado. El ómnibus en cuestión iba por la ruta BR-116, que conecta a San Pablo (sureste) con Vitoria da Conquista (noreste). Existen dos versiones de la tragedia. La primera señala que por la madrugada el micro pinchó un neumático, el chofer perdió el control y chocó contra un camión. La segunda teoría sostiene que un bloque de granito transportado por el otro camión se desprendió encima del ómnibus. En definitiva, luego del choque, el micro se incendió y fue chocado desde atrás por otro automóvil, cuyos pasajeros sobrevivieron. Entre las víctimas del siniestro se encuentra el mismo conductor del ómnibus y, al menos, un menor de edad, mientras que el conductor del camión no sufrió heridas y huyó del lugar. Luiz Inácio Lula da Silva se expresó al respecto en redes sociales:""Lamento inmensamente y mando mis oraciones a los familiares de las más de 30 víctimas fatales del accidente en Teófilo Otoni, Minas Gerais"".También agregó ""rezo por la recuperación de los sobrevivientes de esta terrible tragedia"". Romeu Zema, gobernador de Minas Gerais, declaró estar trabajando ""para que las familias de las víctimas sean atendidas para enfrentar de la forma más humanizada posible esta tragedia en la víspera de Navidad"". Brasil es el tercer país del mundo con más muertes por accidentes de tránsito, escoltando a India y China según un informe de la Organización Mundial de la Salud del año 2023. Esto lo reafirma otro accidente, ocurrido a fines de noviembre en el estado de Alagoas, que dejó un saldo de 17 fallecidos al caer de un barranco. Conocé todas las opciones del contenido que podés recibir en tu correo. Noticias, cultura, ciencia, economía, diversidad, lifestyle y mucho más, con la calidad de información del Grupo Octubre, el motor cultural de América Latina. Este es un contenido original realizado por nuestra redacción. Sabemos que valorás la información rigurosa, con una mirada que va más allá de los datos y del bombardeo cotidiano. Hace 37 añosPágina|12asumió un compromiso con el periodismo, lo sostiene y cuenta con vos para renovarlo cada día.",Desconocido,2024-12-22T00:01:00-03:00,https://www.pagina12.com.ar/792164-un-accidente-con-un-bus-dejo-40-muertos,1.2994014024734497,0.43499999999999994,0.5650000000000001,sociedad
Ilegales y desconectados,"EN VIVO En Colombia, más de la mitad de los hogares rurales no tienen acceso a agua potable;  esas comunidades se ven diariamente obligadas a consumir el recurso hídrico de diversas fuentes como pozos, ríos, quebradas y directamente de la lluvia. Esas más de ocho millones de personas, que permanecen en un estado de vulneración permanente de su dignidad estarán condenadas a perpetuar el ciclo del empobrecimiento para las generaciones venideras, mientras no tengan la garantía del derecho humano más básico asociado a la vida: el acceso al líquido vital. Hay una relación directa entre empobrecimiento y necesidades básicas insatisfechas con la ausencia o escasez de agua potable. Los departamentos que según el Departamento Administrativo Nacional de Estadística (DANE) tienen los mayores niveles de precariedad social son los que carecen de saneamiento básico en la mayoría de sus territorios. Las poblaciones étnicas y campesinas, adicionalmente, a ser las principalmente golpeadas por el conflicto armado en Colombia, padecen el mayor déficit en cobertura de saneamiento básico. En Colombia se ha construido una institucionalidad con crecientes recursos año a año, con la misionalidad de llevar acueductos y alcantarillados a todos los territorios del país; sin embargo, entre demorados proyectos, diseños y falta de articulación de las entidades nacionales con las territoriales han pasado los años sin que se logré avanzar en cobertura. Buena parte de los billonarios recursos invertidos; al parecer, se han ido por la alcantarilla. Por otro lado; esa Colombia profunda que tanto cacarean desde la institucionalidad, y que según los tecnócratas es la que tiene la problemática de falta de acceso a agua potable, no está en las zonas rurales o distantes de los centros urbanos, también se encuentra en las periferias de las ciudades colombianas: inclusive de Bogotá, Medellín y Cali. Recientemente conversé con lideres y lideresas sociales de los barrios Santa Marta, Villa Esperanza, El Triángulo, El Verbenal, Tierra Colorada, San Ignacio, Tierra Nueva, Ciudadela el Paraíso, La Yuquera y Villas del Topacio en la Localidad de Ciudad Bolívar en Bogotá. Todas estas comunidades tienen una condición común: no cuentan con acceso a agua potable ni a alcantarillado; y, en algunos casos, el distrito les cobra el servicio sin que cuenten con él. Desde esa periferia bogotana se vislumbra a la distancia la ciudad capital como si fuera otro territorio separado por la frontera invisible de la indignidad. Estas comunidades urbanas excluidas son víctimas del destierro y del empobrecimiento de la guerra. La historia del poblamiento de estas laderas es la del desplazamiento forzado,  Nunca el distrito los ha acogido con un plan de vida, siempre se han tratado como ilegales e invasores; y por eso, en las proyecciones de ciudad siguen siendo invisibles y hasta ellos no llegan las obras de infraestructura de servicios. Le hace falta comprender a buena parte de los servidores públicos del Estado colombiano, que a la luz de la Constitución Política de 1991 ningún ser humano es ilegal, y que la garantía de derechos no depende de otra consideración distinta al de ser persona. *Abogado y Magíster en Educación. Coordinador del Equipo de Trabajo de Medellín en el Proceso de Comunidades Negras (PCN). Colombia. Publicado originalmente en www.diaspora.com.co Conocé todas las opciones del contenido que podés recibir en tu correo. Noticias, cultura, ciencia, economía, diversidad, lifestyle y mucho más, con la calidad de información del Grupo Octubre, el motor cultural de América Latina. Este es un contenido original realizado por nuestra redacción. Sabemos que valorás la información rigurosa, con una mirada que va más allá de los datos y del bombardeo cotidiano. Hace 37 añosPágina|12asumió un compromiso con el periodismo, lo sostiene y cuenta con vos para renovarlo cada día.",Desconocido,2025-04-23T09:16:29-03:00,https://www.pagina12.com.ar/820279-ilegales-y-desconectados,1.3033771514892578,0.3258310871518419,0.674168912848158,negrx
