titulo,contenido,autor,fecha,url,emocionalidad_full,subjetividad_full,objetividad_full,seccion
Destrucción impactante del sector de la construcción,"EN VIVO Laconstrucciónanotó una caída del 35,2 por ciento respecto de los niveles de junio de 2023, segúninformóel Indec. Como se dijo, el pésimo desempeño de esta actividad es sólo comparable con la crisis en pandemia. En el primer semestre la caída acumulada es de 32,7 por ciento, pese a que en el mes se registró una variación positiva (la tercera consecutiva) de 2,7 por ciento. Estas levísimas mejoras son incipientes para revertir el deterioro. Intensivo en mano de obra, este sector dejó a85.000 personas sin trabajoen mayo de 2024 comparado con igual mes de 2023. “El 2024 está irremediablemente perdido” dijoGustavo Weiss, presidente de la Cámara Argentina de la Construcción (Camarco), en declaraciones radiales a principios de junio. Desde Camarco estiman una pérdida cercana a 100.000 puestos de trabajo. El Gobierno, dijo, frenó obras que tenían más del 90 por ciento en ejecución por priorizar el déficit cero, y dejó obras millonarias avanzadas que ya “no sirven para nada” porque no se habilitan. Así es el tamaño del descuido del gobierno de Javier Milei, obsesionado con el superávit fiscal y sus supuestos beneficios a costa de buena parte de la actividad industrial y de la construcción y, sobre todo, de los puestos de trabajo. Con esa decisión presidencial de paralizar la obra pública, sumada a la recesión interna que también frena las obras residenciales a lo largo y ancho del país, la demanda de insumos y materiales para la construcción se derrumbó desde diciembre del año pasado. En el primer semestre de 2024 acumuló un deterioro del 32,7 por ciento, mientras que al comparar el sexto mes con igual período de 2023, la actividad se encuentra 35,2 por ciento más abajo. No hay señales de recuperación. Ante tamaña caída, la mejora del 2,7 por ciento en la dinámica intermensual (si bien es la tercera consecutiva) no alcanza para teñir de mejor color el panorama. Todos los insumos para la construcción muestran rojos en su tendencia tanto acumulada en el semestre como mes contra mes. Elasfaltolidera la caída un 60 por ciento abajo versus primer semestre de 2023, seguido porhierro redondo y aceros para la construccióncon un deterioro del 48,5 por ciento interanual. La demanda demosaicos graníticos y calcáreoscayó 41,7 por ciento interanual acumulado y laartículos sanitarios de cerámica40,2 por ciento. Enseguida viene la caída en la demanda dehormigón elaboradodel 39,3 por ciento. Depisos y revestimientos cerámicosdel 35,4 por ciento acumulado y deplacas de yesoen 34,5.Pinturas para la construccióncon una merma de 9,9 por ciento acumulada fue el ítem que mejor desempeño tuvo en el semestre. En cuanto a lospuestos de trabajo, según el informe de Indec en mayo se contrataron 382.686 puestos de trabajo registrados en la construcción. Esto arroja una caída del 18,1 por ciento respecto a mayo de 2023 y del 15,8 por ciento acumulado, es decir, en promediose perdieron 84.666 puestos de trabajo registradosen el sector hasta mayo. En el segmento informal, la caída alcanza a otro tanto. Se trata de empleos flexibles y de baja remuneración, la falta en la demanda se traduce de seguro en un incremento de la pobreza, en muchos de estos casos. El Gobierno de Milei no preparó ni analiza ninguna medida para palear la crisis que enfrentan estas miles de familias en su cotidianidad. La importante convocatoria que tuvo la movilización y concentración del miércoles en Plaza de Mayo porSan Cayetanotambién tiene que ver con esta situación.  La superficie autorizada para construcción porpermisos de edificación privadases otro dato relevante respecto de la actividad particularmente en el sector privado, esta mermó 8,1 por ciento respecto a mayo de 2023 y acumula un deterioro del 15,5 por ciento en lo que va del año, según datos relevados por Indec. La situación es crítica pero tampoco respecto del dinamismo de la inversión privada el Gobierno parece tener medidas en agenda. Es una gestión miope que desatiende todos los problemas que tienen que ver con la economía real, en donde finalmente termina por dirimirse el partido: si la economía no crece, la gestión falla. Conocé todas las opciones del contenido que podés recibir en tu correo. Noticias, cultura, ciencia, economía, diversidad, lifestyle y mucho más, con la calidad de información del Grupo Octubre, el motor cultural de América Latina. Este es un contenido original realizado por nuestra redacción. Sabemos que valorás la información rigurosa, con una mirada que va más allá de los datos y del bombardeo cotidiano. Hace 37 añosPágina|12asumió un compromiso con el periodismo, lo sostiene y cuenta con vos para renovarlo cada día.",Mara Pedrazzoli,2024-08-09T11:33:29-03:00,https://www.pagina12.com.ar/758899-destruccion-impactante-del-sector-de-la-construccion,1.3033788204193115,0.39645511720983434,0.6035448827901657,economia
"El gobierno de Trump despide a 10.000 empleados del Departamento de Salud en una ""reestructuración masiva""","EN VIVO Laola masiva de despidosen elDepartamento de Saludy Servicios Humanos(HHS) deEstados Unidoscomenzó este martes, dejando amiles de empleadossin trabajo de manera abrupta. Muchos recibieron notificaciones en la madrugada, mientras que otros se encontraron con elacceso bloqueadoa sus oficinas al llegar a trabajar. El recorte afecta a trabajadores de diversas agencias de salud, desdealtos directivoshastamédicos, y forma parte de la “drástica reestructuración” anunciada el jueves por el secretario de Salud,Robert F. Kennedy Jr., quien considera que el HHS es parte de una “burocracia ineficiente” que, pese a contar con un presupuesto de1.7 billones de dólares, “ha fracasado en mejorar la salud de los estadounidenses”. La medida es parte de la política de reducción del aparato estatal impulsada porDonald Trumpen su segundo mandato. El plan contempla la eliminación de10.000 empleosen el HHS además deotros 10.000 puestosque fueron suprimidos mediantejubilaciones anticipadasy ""retiros voluntarios"" que, junto a lareducción de las divisionesdel HHS de 28 a 15, apuntan a generar un ahorro de1.300 millones de dólaresanuales, apenas una fracción del presupuesto. El viernes anterior se filtró el desglose de los puestos afectados:3.500en la Administración de Alimentos y Medicamentos (FDA);2.400en los Centros para el Control y la Prevención de Enfermedades (CDC);1.200en los Institutos Nacionales de Salud (NIH); y300en los Centros de Servicios para Medicare y Medicaid. “Es un baño de sangre”, denunció un empleado de la FDA. “La FDA, tal como la conocemos, ha desaparecido. La mayoría de los expertos en desarrollo y seguridad de productos ya no están. La historia juzgará esto como ungrave error”, escribió enLinkedInel excomisionado del organismo,Robert Califf. En el NIH, junto a al menoscuatro directoresde sus 27 centros, los recortes también incluyeron a casi todo el personal de comunicaciones. “Este es un ataque sin precedentes a la ciencia y la salud pública”, declaró un alto funcionario del ente bajo condición de anonimato. Se estima que los despidos reducirán la plantilla del HHS a62.000 empleados, eliminandocasi una cuarta parte de su personal, en comparación con los 92.620 empleados que tenía el departamento en septiembre de 2024. La reestructuración apunta a eliminar puestos en todas las áreas, centrándose en posiciones en “regiones de alto costo” o consideradas “redundantes”.  Además, impactarán en los departamentos de saludestatalesylocales, luego de que el HHS decidiera retirar más de11.000 millones de dólaresen fondos destinados a combatir el COVID-19 la semana anterior. Los despidos se enmarcan también en un contexto deerosión de los derechos de los trabajadores federales, después de que el jueves pasado el presidente estadounidense firmara una orden ejecutiva que ponefin a la negociación colectivacon los sindicatos de agencias con misiones de seguridad nacional, como la CDC y otros entes de salud pública. En los CDC, donde la mayoría de los trabajadoresno están sindicalizados, el interés por afiliarse se disparó este año ante las medidas de la administración republicana. Expertos y legisladores expresaron supreocupaciónpor las consecuencias de los despidos. La senadora demócrata por Washington,Patty Murray, advirtió este martes que la reducción de personal en el HHS podría afectar larespuesta ante desastres naturalesobrotes de enfermedadescomo el sarampión, que actualmente se expande en el país. “Podrían llamarlo el Departamento de la Enfermedad, porque este plan pone vidas en serio peligro”, dijo Murray el viernes. El aparente desmantelamiento del sistema de salud pública y la erosión de los derechos laborales generaron una fuerte reacción en la oposición. “El descarado intento del presidente Trump de despojar a los empleados federales de sus derechos sindicales elimina protecciones conquistadas con esfuerzo”, señalaron en un comunicado los representantes demócratasGerald ConnollyyBobby Scott. Desde el lunes por la noche, el senador demócrata por Nueva Jersey,Cory Booker, llevó adelante un discurso maratónico en el Senado para denunciar la agenda de Trump, y el ataque a instituciones, como las agencias de Salud y Medicaid, realizado ""de manera imprudente, incluso inconstitucional"". “Estos no son tiempos normales en Estados Unidos”, afirmó Booker al inicio de su discurso demás de 17 horas, en el que criticó losrecortesa instituciones federales y la crecienteconcentración de poderen la presidencia y su circulo. ""En sólo 71 días, el presidente ha infligido undaño enormea la seguridad de los estadounidenses, la estabilidad financiera y los cimientos de nuestra democracia"", protestó. También advirtió que muchas de las decisiones del mandatariobenefician desproporcionadamente a los sectores más ricosdel país. “¿Cómo pueden justificar recortar800.000 millones de dólaresen Medicaid solo para financiar exenciones fiscales a los más ricos?”, cuestionó Booker. También pidió a los congresistas que se unan para bloquear algunas de las decisiones más agresivas de Trump. ""Este no es un momento partidista, es un momento moral. (...)No es un momento de izquierda o derecha, es un momento de lo correcto o lo incorrecto"", zanjó el demócrata. Pese a sus esfuerzos, la mayoría republicana en el Senado continúa avanzando con su agenda de recortes y desregulación, en un contexto de creciente tensión política y social. Conocé todas las opciones del contenido que podés recibir en tu correo. Noticias, cultura, ciencia, economía, diversidad, lifestyle y mucho más, con la calidad de información del Grupo Octubre, el motor cultural de América Latina. Este es un contenido original realizado por nuestra redacción. Sabemos que valorás la información rigurosa, con una mirada que va más allá de los datos y del bombardeo cotidiano. Hace 37 añosPágina|12asumió un compromiso con el periodismo, lo sostiene y cuenta con vos para renovarlo cada día.",Desconocido,2025-04-02T00:01:00-03:00,https://www.pagina12.com.ar/814999-el-gobierno-de-trump-despide-a-10-000-empleados-del-departam,1.3185864686965942,,,el-mundo
"Venezuela: el gobierno rechazó el ""proceso de despojo"" de Citgo en Estados Unidos","EN VIVO El gobierno de Venezuelarechazó este lunes el ""proceso de despojo"" deCitgo, la petrolera venezolana que se encuentra en Estados Unidos, y advirtió queno reconocerá la ""venta forzosa"" de la empresaal considerar que no se cumple con las garantías económicas, el debido proceso y el derecho a la defensa.La administración deNicolás Madurodijo que se reserva acciones judicialescontra quien participe en la venta de la empresa que está en la mira de acreedores del país caribeño. Citgo, filial de la estatal Petróleos de Venezuela (Pdvsa) en Estados Unidos, es blanco de un proceso de venta, autorizado por una corte de ese país ante demandas de acreedores por expropiaciones y deudas que superan los 20 mil millones de dólares. La operación está parada, al menos hasta agosto, por una orden del gobierno estadounidense que impide a los tenedores de bonos tomar el control del 50,1 por ciento de las acciones de la empresa. ""Venezuela reitera que no reconoce ni reconocerá la venta forzosa de Citgo, que se lleva en flagrante desprecio de las garantías económicas, el debido proceso y el derecho a la defensa garantizados por cualquier nación civilizada"", señaló Caracas en un comunicado difundido por la vicepresidenta Delcy Rodríguez en su cuenta de la red X. El gobierno indicó además que ""se reserva acciones frente a cualquier empresa o individuo que adquiera las acciones, facilite la compra o negocie con los activos de Citgo, así como contra los responsables del despojo de este activo de gran importancia"". ""Venezuela y Pdvsa fueron excluidos de la venta judicial de Citgo y se les impidió defender sus derechos ante los tribunales estadounidenses"", señaló el comunicado oficial, que agrega que ""el pueblo venezolano sabrá responder, en gran unión nacional, para rechazar este robo descaradodel gobierno de los Estados Unidos de América junto a los criminales del extremismo venezolano"". La administración de Nicolás Maduro sostiene que, junto a la estatal Petróleos de Venezuela,fue excluida de la venta judicial de Citgo y se le impidió defender sus derechos ante los tribunales estadounidenses, en complicidad con los opositores Leopoldo López, Julio Borges y Juan Guaidó, a quien Estados Unidos consideró entre 2019 y 2023 presidente de Venezuela luego de desconocer la reelección del mandatario socialista. El pasado 27 de mayo el opositor Antonio Ecarri, candidato a la presidencia de Venezuela, pidió al mandatario de Estados Unidos, Joe Biden, aplazar cualquier acción contra Citgo hasta que asuma el poder quien gane las elecciones presidenciales en la nación sudamericana, previstas para el 28 de julio. A través de una carta Ecarri recordó que Citgo corre el riesgo de ser embargada debido a los impagos del país. Debido a las deudas mencionadas, un grupo de acreedores tiene órdenes de embargo que, para ser ejecutadas, necesitan una autorización de la Oficina de Control de Activos Extranjeros (OFAC). Por ese motivo, así como por las restricciones que implicanlas sanciones impuestas a Venezuelay porque las instituciones estadounidenses no reconocen la legitimidad del gobierno de Maduro, Ecarri le pidió a Biden que posponga cualquier venta de Citgo. Un tribunal federal en Delaware, Estados Unidos, confirmó que ""el gobierno de Guaidó ha recurrido directamente a las filiales comerciales de Pdvsa en Estados Unidos, eludiendo el derecho corporativo de Pdvsa a recibir dividendos"" y que la administración de Donald Trump le dio a la oposición venezolana acceso a las cuentas bancarias pertenecientes a la empresa estatal en suelo estadounidense. El portal de noticias Tal Cual informó que ""el mismo gobierno interino ha utilizado estos fondos para el financiamiento de los litigios en los que Venezuela se mantiene para intentar defender los activos del país en tribunales internacionales"". Aunque Maduro perdió el control de la empresa, su gobierno emitió bonos de Pdvsa en 2020 que daban 50,1 por ciento de las acciones de Citgo como garantía. Normalmente las naciones y las empresas públicas se consideran entes separados, pero algunas compañías esgrimen que Pdvsa es un ""alter ego"" de Venezuela, por lo cual sería un activo disponible para pagar compromisos de la compañía estatal y de la nación.  Los 20 mil millones que reclaman los acreedores incluyen lo adeudado por esos bonos así como expropiaciones de activos petroleros y mineros en Venezuela. Según se supo el 11 de julio, el tribunal de Delaware empezó a aceptar ofertas vinculantes por las acciones de Citgo. La subasta de acciones organizada para pagar a los acreedores, entre ellos el productor de petróleo ConocoPhillips, Rusoro, Crystallex y Gold Reserve, atrajo a inversores y empresas con recursos sustanciales, lo que aumenta las posibilidades de un cambio de propiedad para la séptima refinería más grande de Estados Unidos, según informó el portal Tal Cual. El ministro de Relaciones Exteriores de Venezuela, Yván Gil, reconoció el jueves pasado que la refinería Citgo está ante el ""riesgo inminente"" de ser subastaday dijo que la misma está ""bloqueada"" desde el año 2019. Gil, quien participó de una sesión de la Asamblea General de la ONU, aseguró que debido al ""lawfare"" por parte de un tribunal de EE.UU., junto a ""entidades ficticias reconocidas por Washington"", la empresa está a punto de caer en manos de corporaciones estadounidenses y canadienses. Juan Martínez, dirigente del Sindicato de Trabajadores del yacimiento Sincor en el estado de Anzoátegui, aseguró que es crucial que los trabajadores sean indemnizados ante una posible pérdida de Citgo.""Perdimos décadas de experiencia y habilidad técnica casi de la noche a la mañana"", lamentó Martínez al diarioEl Nacionaly agregó que los despidos que ya se están produciendo envían ""un mensaje alarmante sobre cómo los trabajadores pueden ser tratados en tiempos de crisis políticas o económicas, lo que afectó negativamente la percepción de la industria a nivel global"". Citgo es la mayor filial de la estatal Pdvsa fuera del territorio venezolano. La principal infraestructura de la empresa después del 2015 la constituyen sus tres refinerías y una red compuesta por casi 4.200 estaciones de servicio independientes, distribuidas en el extenso territorio de los Estados Unidos. La empresa tiene una capacidad de refinación de 807 mil barriles por día y está valuada entre unos 11 mil y 13 mil millones de dólares. Desde 2005 Citgo desarrolló campañas de asistencia a personas de bajos recursos en Estados Unidos.El programa empezó a implementarse después de los huracanes Rita y Katrina, cuando el expresidente Hugo Chávez ofreció ayuda, a través de Citgo, para las comunidades norteamericanas devastadas por las tormentas. En colaboración con la ONG Citizens Energy Corporation, Citgo distribuyó gratuitamente 860 millones de litros de gasoil a dos millones de estadounidenses entre 2005 y 2009. Conocé todas las opciones del contenido que podés recibir en tu correo. Noticias, cultura, ciencia, economía, diversidad, lifestyle y mucho más, con la calidad de información del Grupo Octubre, el motor cultural de América Latina. Este es un contenido original realizado por nuestra redacción. Sabemos que valorás la información rigurosa, con una mirada que va más allá de los datos y del bombardeo cotidiano. Hace 37 añosPágina|12asumió un compromiso con el periodismo, lo sostiene y cuenta con vos para renovarlo cada día.",Desconocido,2024-06-18T00:01:00-03:00,https://www.pagina12.com.ar/745344-venezuela-el-gobierno-rechazo-el-proceso-de-despojo-de-citgo,1.3193062543869019,,,el-mundo
"Fuerte temporal en Santa Fe: un muerto, destrozos, evacuados, inundaciones y clases suspendidas","EN VIVO A dos semanas deltemporal que provocó víctimas fatales y desastres en infraestructura en las localidades bonaerenses de Campana y Zárate, unafuerte tormenta azotóesta madrugada a la provincia deSanta Fe: según reportaron las autoridades, hayuna persona fallecida,destrucciones materiales,evacuados,inundacionesyclases suspendidasen varias localidades producto de la abundante lluvia en pocas horas. Un aviso meteorológico por ""tormentas fuertes con lluvias intensas y ráfagas"" se mantiene desde las 16 de este lunes para las localidades deGeneral Obligado y Vera, las más afectadas de la provincia santafesina, según la Secretaría de Protección Civil y Gestión de Riesgos. En rigor, la ciudad santafesina deVera es la que se encuentra en una situación más crítica, ya que cayeron más de400 mm de agua, un volumen que equivalealpromedio histórico de mesesen la región central del norte santafesino.  En el marco de esta situación extraordinaria,la Municipalidad deVera decretó la emergencia hídricay la junta de Protección Civil comenzó a coordinar la asistencia a sus habitantes. En ese lugar, varios vecinos debieron ser evacuados ante las inundaciones por la fuerte precipitación. Asimismo,una mujer murió de un infartoal ver que su casa de inundaba, según contó su hijo a las autoridades policiales. Otras personas fueron hospitalizadas por ataques de pánico y hasta se registró una emergencia obstétrica que demandaba atención urgente, según describió La Capital de Santa Fe. La intendenta de Vera, Paula Mitre, confirmó quela ciudad,ubicada a unos 500 kilómetros de Rosario,se convirtió en el escenario de una""catástrofe""debido a las abundantes precipitaciones. Lasimágenes de los estragosque provocó la tormenta en esas localidades de Santa Fe empezaron a circular por las redes sociales desde la madrugada de este martes. Lo que se ve soncalles anegadas,autosque estaban estacionados en las callessumergidosen el agua, y personas intentando cruzar a pie lascorrentadas de aguacon algunas pertenencias o niños y mascotas a cuestas. Los vecinos de los barrios de Martín Fierro y San Martín de Porres habrían sido los más afectados. El centro barrial de esta última zona es uno de los cuatro puntos de atención a quienes abandonaron sus hogares. El resto fue trasladado a los clubes Huracán, Ferro y Gimnasia. En este contexto, desde la Municipalidad informaron que ya se encuentra en la ciudad “personal de la Secretaría de Protección Civil de la Provincia colaborando con la junta local”. Asimismo, se espera que, a primera hora hoy llegue a Vera “maquinaria y equipos de la Secretaría de Recursos Hídricos para ayudar ante la emergencia climática”.  Asimismo, en respuesta a la dramática situación que viven distintas localidades santafesinas,varias escuelas suspendieron las clasesen todos sus niveles. Se dispuso también que los empleados municipales que no estén involucrados en las tareas de emergencia queden desafectados de sus funciones el martes. La Municipalidad de Vera convocó a laJunta de Protección Civil localpara coordinar las tareas de emergencia, y se estableció unCentro de Evacuados en el Club Gimnasia. Hasta la medianoche de este lunes, 28 personas habían sido evacuadas a este lugar. Además, se habilitó una línea telefónica (3483-490824) para asistir a las familias que requieran evacuación. Además, una dotación del cuerpo de Bomberos Voluntarios de Reconquista, liderada por el jefe César Romano, se desplazó a la ciudad antes de la medianoche para brindar apoyo junto a otros cuarteles de la región.  Según el Servicio Meteorológico Nacional, para lo que resta de este martescontinuarán las tormentas fuertes hasta la noche en gran parte de la provincia santafesina. En la mañana todavía rige elalerta naranja, por lo quelas autoridades piden que la gente no salga de sus casas. A las 08.44 de hoy emitieron un aviso a corto plazo para el noreste de la provincia de Santa Fe, gran parte del noroeste de Corrientes, y el sureste de Chaco. Otras provincias de la región se encuentran bajoalerta meteorológicopor tormentas: enChaco, el aviso fue dirigido a la comunidad de 1º de Mayo, Bermejo, Libertad, San Fernando y Tapenaga; y enCorrientes, para las localidades de Bella Vista, Beron de Astrada, Concepcion, Corrientes Capital, Curuzu Cuatia, Empedrado, Goya, General Paz, Itati, Ituzaingo, Lavalle, Mburucuya, Mercedes, Saladas, San Cosme, San Luis del Palmar, San Martin, San Miguel y San Roque. El Servicio Meteorológico Nacional emitió esta madrugada unalerta de color anaranjadopor fenómenos meteorológicospeligrosospara la sociedad, la vida, los bienes y el medio ambientepara varias provincias del norte: incluye el noreste deSanta Fe, la totalidad deCorrientes, el norteste deEntre Ríos, el suroeste deMisiones, así como el este deChacoyFormosa. Sin embargo, el resto de los territorios de cada una de éstas se encuentra pintado deamarillo, un alerta que se traduce como ""posibles fenómenos meteorológicoscon capacidad de daño y riesgo de interrupción momentánea de actividades cotidianas"". El aviso amarillo es porvientos fuertesy aplica a laCosta bonaerense, aCatamarca,Chaco,Córdoba,Formosa,Jujuy,La Rioja,Salta,San Juan,San Luis,Santa Fe,Santiago del Estero,Tucumány por últimoTierra del Fuego, Antártida e Islas del Atlántico Sur. Conocé todas las opciones del contenido que podés recibir en tu correo. Noticias, cultura, ciencia, economía, diversidad, lifestyle y mucho más, con la calidad de información del Grupo Octubre, el motor cultural de América Latina. Este es un contenido original realizado por nuestra redacción. Sabemos que valorás la información rigurosa, con una mirada que va más allá de los datos y del bombardeo cotidiano. Hace 37 añosPágina|12asumió un compromiso con el periodismo, lo sostiene y cuenta con vos para renovarlo cada día.",Desconocido,2025-05-28T00:01:00-03:00,https://www.pagina12.com.ar/829068-fuerte-temporal-en-santa-fe-un-muerto-destrozos-evacuados-in,1.3207467794418335,,,sociedad
