titulo,contenido,autor,fecha,url,emocionalidad_full,subjetividad_full,objetividad_full,seccion
Cayó un avión en Brasil: al menos 9 personas murieron y 15 resultaron heridas,"EN VIVO Al menosnueve personas murierony 15 resultaron heridas este domingo tras lacaída de un aviónde pequeño porte en la ciudad turística de Gramado, en el estado de Rio Grande do Sul, sur de Brasil. Por el momento, se desconocen los motivos del siniestro. ""Hay nueve muertos confirmados por (los servicios de) Defensa Civil yno hay sobrevivientes del avión"", informó el comisario Cléber dos Santos Lima, director del Departamento de Policía del Interior de la Policía Civil del estado. La aeronave, un turbohélice Piper Cheyenne 400,se estrelló la mañana del domingo ""contra la chimenea de un edificio, luego contra el segundo piso de una casa y después cayó sobre una tienda de muebles"", precisó en un comunicado la Secretaría de Seguridad Pública de Rio Grande do Sul. Los destrozos ""también alcanzaron a una posada"", añadió el comunicado. Por el accidente tambiénresultaron heridas al menos 15 personas, que fueron trasladadas al hospital de la zona, la mayoríapor haber inhalado humo del incendioque se desató tras la caída de la aeroanave, que ya fue controlado por los bomberos.  El aviónhabía despegadoeste domingo del aeropuerto regional deCanela, próximo a Gramado, yse dirigíaa la ciudad costera deFlorianópolis, otro popular destino turístico para el periodo navideño, de acuerdo con el Cuerpo de Bomberos. El gobernador de Rio Grande do Sul,Eduardo Leite, lamentó las muertes y dijo que está ""acompañando junto a las fuerzas de seguridad del Estado el triste episodio"", al tiempo que remarcó quela prioridad en este momento es aislar el área y atender a los heridos. Gramado es una popular ciudad turística en Brasil, con importante afluencia de visitantes en la época de Navidad. Este es el segundo accidente con varias víctimas fatales este fin de semana en Brasil, luego de que41 personas murieran el sábado en un accidente de ómnibus en Minas Gerais (sureste). Conocé todas las opciones del contenido que podés recibir en tu correo. Noticias, cultura, ciencia, economía, diversidad, lifestyle y mucho más, con la calidad de información del Grupo Octubre, el motor cultural de América Latina. Este es un contenido original realizado por nuestra redacción. Sabemos que valorás la información rigurosa, con una mirada que va más allá de los datos y del bombardeo cotidiano. Hace 37 añosPágina|12asumió un compromiso con el periodismo, lo sostiene y cuenta con vos para renovarlo cada día.",Desconocido,2024-12-23T11:52:12-03:00,https://www.pagina12.com.ar/792252-cayo-un-avion-en-brasil-al-menos-9-personas-murieron-y-15-re,1.32102370262146,0.42918313570487493,0.570816864295125,sociedad
El colapso de $LIBRA está destruyendo su plataforma de lanzamiento,"EN VIVO El escándalo de la memecoin de$LIBRA,que tras alcanzar un pico se desplomó el sábado a la madrugada generando pérdidas millonarias, sigue teniendorepercusiones en el mercado de criptomonedas.Entre los activos más afectados está Solana, la sexta mayor criptomoneda, sobre cuya plataforma se lanzó $LIBRA. Desde el viernes 14 de febrero,Solana sufrió una caída de 22,5 por ciento de su valor de mercado. El viernes cotizaba a 205 dólares y cayó a 161 dólares el martes, para luego recuperar algo de terreno. Este desplome se traduce en una pérdida cercana a 20.000 millones de dólares en capitalización de mercado, según datos de Bloomberg. Lapopularidad de Solana entre desarrolladores de memecoinsse debe a sus bajas tarifas y alta velocidad de transacción. En su plataforma se han lanzado tokens asociados a figuras políticas como TRUMP y MELANIA, vinculados a la familia del presidente estadounidense Donald Trump. Sin embargo, el desplome de LIBRA y otras memecoins ha puesto en jaque la confianza en estos activos especulativos. Elmercado de memecoinsha crecido exponencialmente con la creación de miles de tokens sin valor subyacente. A través de la plataforma Pump.fun, se han lanzado alrededor de 60.000 tokens en la blockchain de Solana. Sin embargo, el colapso de LIBRA ha generado preocupación por la falta de regulación y el impacto de estos activos en la estabilidad del ecosistema cripto. ""El mercado está preocupado por el contagio de responsabilidad"", señaló Henry Elder, de UTXO Management. ""Cada minuto parece que otro líder del ecosistema Solana está implicado en LIBRA y otros lanzamientos de tokens que han proliferado en su red en los últimos meses"". El desplome de TRUMP y MELANIA, que han perdido 80 y 70 por ciento de su valor respectivamente desde sus máximos, refuerza la desconfianza sobre estas criptomonedas. LIBRA, en tanto, se ha desplomado un 90 por ciento desde su lanzamiento, según CoinMarketCap. Las memecoins han sido consideradas un fenómeno cultural dentro del ecosistema cripto. Dogecoin, por ejemplo, comenzó como una broma pero ha logrado consolidarse con un valor de mercado de 36.000 millones de dólares. No obstante, la proliferación de nuevos tokens ha resultado en esquemas de""pump-and-dump"" y ""rug pulls"",donde los creadores manipulan los precios para su beneficio y dejan a los inversores con activos sin valor. Zaheer Ebtikar, fundador del fondo de criptomonedas Split Capital, advirtió que ""el uso actual de Solana podría traer problemas mayores a largo plazo"". Señaló que la gran cantidad de emisiones de tokens altamente especulativos está afectando la credibilidad del ecosistema. Otra posible razón para la caída de Solana es la inminente liberación de 1.800 millones de dólares en tokens el próximo 1° de marzo, lo que podría aumentar la oferta y presionar a la baja los precios. ""Muchos inversores están anticipando las ventas previstas por el desbloqueo"", explicó Jeff Dorman, director de inversiones de Arca. Además, el impacto negativo de Pump.fun y otras iniciativas han pesado sobre el precio de Solana. Laincertidumbre también afecta a la comunidad de desarrolladores.Anatoly Yakovenko, cofundador de Solana, respondió a una publicación en X (antes Twitter) que predecía el fin de la criptomoneda con un enigmático mensaje: ""La muerte es la única salida de este infierno"". Para muchos críticos, el episodio de $LIBRA es otra muestra de los riesgos asociados a las memecoins. Austin Campbell, director ejecutivo de la empresa de stablecoins WSPN USA, alertó en X: ""Esto es incluso peor que las apuestas, son apuestas no reguladas"". Advirtió que los inversores deben asumir que, al comprar una memecoin nueva, hay una alta probabilidad de ser estafados. Detrás de estos tokens hay promotores que buscan explotar la fiebre especulativa. ""Hay personas sembrando estos activos con influencers a cambio de dinero, cerrando acuerdos privados y manipulando sus propios lanzamientos para extraer todo el valor posible antes de abandonar el mercado"", concluyó Campbell. Conocé todas las opciones del contenido que podés recibir en tu correo. Noticias, cultura, ciencia, economía, diversidad, lifestyle y mucho más, con la calidad de información del Grupo Octubre, el motor cultural de América Latina. Este es un contenido original realizado por nuestra redacción. Sabemos que valorás la información rigurosa, con una mirada que va más allá de los datos y del bombardeo cotidiano. Hace 37 añosPágina|12asumió un compromiso con el periodismo, lo sostiene y cuenta con vos para renovarlo cada día.",Federico Kucher,2025-02-20T00:01:00-03:00,https://www.pagina12.com.ar/805309-el-colapso-de-libra-esta-destruyendo-su-plataforma-de-lanzam,1.321567177772522,0.44859345333029543,0.5514065466697046,economia
Juicio por la muerte de Diego Maradona: la jueza Makintach fue recusada y el juicio anulado,"EN VIVO “Hubo una persona que se equivocó (la jueza Julieta Makintach) y deberá seguir dando explicaciones, pero la Justicia no se mancha”. Con esta frase grandilocuente, pero que cayó mal, muy mal, en el Poder Judicial, los dos integrantes del Tribunal Oral número 3 de San Isidro les dijeron a todas las partes que el juicio por la muerte de Diego Maradona resultó nulo y que habrá que hacer otro juicio. En las cámaras superiores –la de Apelaciones de San Isidro y en la Casación y en la Corte Suprema bonaerense– creen todo lo contrario: la Justicia quedó manchada. Makintach actuó de manera parcial para quedar como una heroína de una condena, porque ella ya había decidido, de antemano, que al menos tres de los acusados iban a ser condenados y ella sería recibida como una de las estrellas de esa condena. Nadie la paró, nadie se dio cuenta. El golpe definitivo al juicio se lo dio la Corte, que usó calificativos como ”grave, inusitado, irregular, incumplimiento de los deberes” para suspender a Makintach y ponerla en camino a su destitución. Sus dos colegas del tribunal, Maximiliano Savarino y Verónica Di Tommaso, fueron mucho más suaves, aunque la conclusión fue la misma: juicio nulo, habrá que hacer otro. Los fiscales piden que sea este año, la mayoría de los abogados defensores y querellantes piensan que no hay chances de arrancar en 2025. Otros tienen diagnósticos aún peores   De esta manera,todo el proceso penalvuelve a foja uno. Es decir, se pierden los tres meses de audiencias realizados hasta el momento. La fecha oficial de su reinicio será confirmada más adelante, aunque trascendió que podría ocurrir enenero 2026. Maximiliano SavarinoyVerónica Di Tommaso, los dos jueces que quedaron a cargo del juicio, aceptaron la recusación de Makintach, anunciaron que no se puede continuar con un juicio que estáviciadoy definieron su apartamiento del proceso. Puntualmente, Savarino culpó a la magistrada Makintach por la nulidad del juicio al señalar quees ""la única responsable""y aseguró que el proceso judicial ""no corresponde que se reanude"" en el mismo tribunal.   ""Los suscriptosno podemos asumir nuevamente el debateporque escuchamos a 40 testigos y una imputada"", señaló. ""Hay que seguir adelante, vamos a volver a declarar, creo que va a haber justicia, si hay que hacerlo mil veces lo vamos a hacer"", dijo Verónica Ojeda, madre del hijo menor del ""Diez"".  El juicio fue anulado a raíz de la revelación de las imágenes que pertenecen aJusticia Divina, una presuntaserie-documental sobre el juicio por la muerte de Maradona, que se encontraba en desarrollo. La filtración de untráiler y de un primer episodioen el que se mostraban imágenes del juicio, testimonios, e incluso primeros planos y declaraciones exclusivas de Makintach, hicieron suponer tanto a la querella como a los acusados quetodo el proceso judicial había sido contaminado. Diego Armando Maradonafalleció a los 60 años el 25 de noviembre de 2020, víctima de un “edema agudo de pulmón” y de “una insuficiencia cardíaca”. Sin embargo, tras su fallecimiento, se suscitaron una serie dedenuncias por omisión, es decir, por incumplimiento de deberes y atenciones al ídolo popular, quien contaba con severas complicaciones de salud. Tras la denuncia que radicó la familia de ""Pelusa"", quedaron imputados por presunto el delito de ""homicidio simple con dolo eventual"" el médicoLeopoldo Luciano Luque; la psiquiatraAgustina Cosachov; el psicólogoCarlos Ángel Díaz; la jefa de Swiss Medical,Nancy Edith Forlini; el coordinador de Medidom S.R.L,Mariano Ariel Perroni; el enfermeroRicardo Omar Almirón; y el médico clínico designado para la internación domiciliaria,Pedro Pablo Di Spagna. También está imputada la enfermeraGisela Dahiana Madrid, pero a diferencia del resto de los acusados, ella iba a enfrentar un juicio por jurados durante el segundo semestre, una vez que finalizara el debate principal.  En tanto, durante el juicio, que había comenzado en marzo, se habían realizado19 audiencias,por las que pasaron más de 44 testigos, entre ellos,peritos,profesionales de la junta médica,familiares y cercanos a Maradona. Uno de los puntos que se perderán con la determinación del Tribunal es laacusación contra el excustodio del futbolista,Julio César Coria, quien en medio del debate había sido detenido frente al Tribunal,acusado de falso testimonio. Sin embargo, por la nulidad, esta acusación perdió validez. A su vez, todas lasdeclaracionesdesarrolladas a lo largo de las diversas audienciastampoco serán tomadas en cuenta cuando se realice el nuevo juicio, por lo que todos los testigos deberán volver a dar testimonio. En este sentido,se echaron a perder las declaraciones más importantes, por ejemplo, las referidas a la autopsia, la agonía que sufrió Maradona, la reunión previa a la externación, la duda sobre si hacía falta operarlo, cómo vivió sus últimos días, el entorno, y la historia clínica.  Acerca de los dosallanamientosllevados a cabo en laClínica Olivos, lugar donde operaron a Maradona del hematoma subdural, y laempresa Medidom, que se encargó de la internación domiciliaria del jugador,las pruebas secuestradas tampoco serán legítimas. Tras la divulgación de las polémicas imágenes del documental, el Tribunal Nº3 de San Isidro había decidido apartar a Makintach del juicio. En tanto, la Corte Suprema de Justicia bonaerensesuspendió a la magistrada por 90 días. “Prima faciese trata de unaconducta alejada de la sobriedad,la mesura y la corrección exigibles a todo servidor de este poder del Estado”, insistió la Corte.  Con la suspensión, la jueza pasará acobrar la mitad del sueldo. Cuando se terminen los 90 días, se estima con que se renovará la suspensión por otros 90 días, y así sucesivamente hasta que se haga el jury de enjuiciamiento, lo que podría tardar muchos meses. Asimismo, este lunes fue suspendida por tiempo indeterminado como docente de laFacultad de Derecho de la Universidad Austral, que a su vezle inició un sumario. Conocé todas las opciones del contenido que podés recibir en tu correo. Noticias, cultura, ciencia, economía, diversidad, lifestyle y mucho más, con la calidad de información del Grupo Octubre, el motor cultural de América Latina. Este es un contenido original realizado por nuestra redacción. Sabemos que valorás la información rigurosa, con una mirada que va más allá de los datos y del bombardeo cotidiano. Hace 37 añosPágina|12asumió un compromiso con el periodismo, lo sostiene y cuenta con vos para renovarlo cada día.",Desconocido,2025-05-30T01:04:11-03:00,https://www.pagina12.com.ar/829655-juicio-por-la-muerte-de-diego-maradona-la-jueza-makintach-fu,1.3244116306304932,,,sociedad
Otro gigantesco fraude como en 2018,"EN VIVO El Foro Economía y Trabajo sostuvo, en relación al anuncio del envío al Congreso de un decreto de necesidad y urgencia para habilitar un nuevo endeudamiento con el FMI, que ""no es necesario ningún acuerdo con el Fondo Monetario, y menos con cláusulas secretas que no se comunican al Congreso de la Nación Argentina para su tratamiento ni se ponen en conocimiento de su Pueblo, que siempre paga las consecuencias"". El Foro está conformado por economistas y especialistas en otras disciplinas convocados por organizaciones gremiales, sociales y pymes para formular propuestas en materia económica alternativas a la política en ejecución por parte del gobierno nacional. Advierte además que el Presidente Milei requiere su aprobación “a ciegas”, desconociendo que la Constitución Nacional determina que corresponde al Congreso: “arreglar el pago de la deuda interior y exterior de la Nación”. Y no cumple con la Ley 27.612 que establece que “todo programa de financiamiento u operación de crédito público realizado con el FMI, así como también cualquier ampliación de los montos de esos programas u operaciones, requerirá de una ley del honorable Congreso de la Nación que lo apruebe expresamente”. ""No cabe duda que las condiciones de ese acuerdo no se hacen conocer pues implican la cesión de importantes activos nacionales, y profundizarán el ajuste económico impuesto por el actual gobierno, para acelerar una brutal transferencia de recursos de los trabajadores, jubilados y familias hacia: a) las grandes corporaciones financieras de las que, en los hechos, el FMI es garantía en última instancia aun en contra de los intereses de los países que lo integran, como sucedió en 2018 por la gestión de Luis Caputo habilitando una fuga de capitales por 44.000 millones de dólares. b) las grandes exportadoras, importadoras y oligopolios formadores de precios que liberados de obligaciones por los decretos de Javier Milei imponen precios excesivos a los alimentos, la energía, el transporte, los medicamentos, la atención a la salud, e insumos imprescindibles para la industria. c) los comisionistas u operadores que pudieran estar vinculados incluyendo corporaciones financieras y sus directivos, funcionarios, legisladores, consultoras y bufetes especializados que pueden haber coadyuvado o coadyuvan a “gestionar” el círculo vicioso del endeudamiento, incluso criminalmente y atentando contra el orden económico financiero. Dice luego el documento del Foro que, ""Con este esquema y esas condiciones, que también afectarán el tipo de cambio, no es que los “precios caros” bajarán como dice el mismo Luis Caputo. Lo que seguirá bajando es el poder adquisitivo de las familias y la demanda en el mercado interno, profundizando la economía del desastre, sosgtiene el informe"". ""El gobierno miente. No es cierto que la deuda no aumentará por este nuevo acuerdo.  La deuda externa aumentará. Y las decisiones de este gobierno y los sucesivos quedarán condicionadas a las metas ocultas que se acuerdan con el FMI. ""Es decir, estamos ante un nuevo y gigantesco fraude que - como en 2018- no podría hacerse sin el concurso de las autoridades del Fondo, que no pueden desconocer que así se empuja a Argentina hacia un default, lo que incluso pudiera ser un objetivo, habida cuenta de la crítica situación en un mundo donde se multiplican los conflictos y se potencian las guerras. ""En ese contexto, Argentina está en una grave emergencia institucional, con graves carencias de seguridad jurídica, donde el  titular del Poder Ejecutivo declarando su objetivo de destruir el Estado, se arroga facultades legislativas, y el Poder Judicial está afectado en parte, pero en todas sus jurisdicciones, de un grave deterioro institucional"". Y continúa el documento del Foro advirtiendo: ""Cabe por cierto preguntarse, si, según el Presidente Milei, el objetivo que es “destruir al Estado” ¿cómo puede esperarse que éste cumpla su obligaciones nacionales e internacionales? ""Por lo mismo volvemos a señalar: 1)     La deuda con el FMI deben pagarla quienes se beneficiaron con ella. El Congreso de la Nación en uso de sus facultades constitucionales y legales debe retomar, tratar y aprobar el Proyecto para la creación de un Fondo Nacional para el pago de la deuda con el Fondo Monetario Internacional, con recursos provenientes de quienes no cumplieron con sus obligaciones tributarias legales y/o se beneficiaron de ella. Esto en su parte que se considere legítima, lo que requiere que se den curso a las denuncias que obran en manos de la Justicia, inclusive fundadas en detallados informes de la Auditoría General de la Nación. En este sentido haciéndose cargo del riesgo moral e institucional asumido, ese Fondo también debe devolver los sobrecargos que cobró y suspenderlos de inmediato. 2)     El Congreso de la Nación debe hacerse cargo de toda negociación sobre la deuda pública tal como dispone la Constitución Nacional y derogar con urgencia las facultades legislativas que inconstitucionalmente se ha arrogado y se han concedido al Presidente de la República. 3)     El Congreso de la Nación tiene mora en constituir una Comisión de Seguimiento de la deuda externa, que investigue el acuerdo contraído ilegalmente por el Gobierno del Sr.  Mauricio Macri con el FMI, organismo que lo otorgó violentando de manera flagrante su propio Convenio Constitutivo. 4)     Argentina debe garantizar el funcionamiento constitucional del Estado, y la debida seguridad política, para ello y por las razones señaladas debe iniciarse el procedimiento de Juicio Político. 5)     Todas y todos los legisladores nacionales tienen obligaciones inexcusables en relación a estas cuestiones, incluyendo la que hace a la inmediata derogación del DNU por el que el Poder Ejecutivo pretende imponer el nuevo acuerdo con el FMI. Y análogas obligaciones tiene la Suprema Corte de Justicia. ""Las naciones integrantes del Fondo Monetario deben tomar nota, y las autoridades de este organismo deben hacerse cargo de que en estas condiciones es evidente la inviabilidad del cumplimiento de acuerdos de estas características fraudulentas. Es decir, podrá ser calificada como deuda odiosa la generada en este acuerdo y por lo tanto sujeta a un default selectivo de la Nación Argentina, habida cuenta que se conocen de antemano las consecuencias"", finaliza. Conocé todas las opciones del contenido que podés recibir en tu correo. Noticias, cultura, ciencia, economía, diversidad, lifestyle y mucho más, con la calidad de información del Grupo Octubre, el motor cultural de América Latina. Este es un contenido original realizado por nuestra redacción. Sabemos que valorás la información rigurosa, con una mirada que va más allá de los datos y del bombardeo cotidiano. Hace 37 añosPágina|12asumió un compromiso con el periodismo, lo sostiene y cuenta con vos para renovarlo cada día.",Desconocido,2025-03-09T00:01:00-03:00,https://www.pagina12.com.ar/809361-otro-giganteso-fraude-como-en-2018,1.3248465061187744,,,economia
